{
  "receipt_id": "DCPR-20260525-EXAMPLE0SMASHRTX509000A",
  "schema_version": "v0.1",
  "supersedes": null,
  "asset_identity": {
    "asset_id": "smash-rtx5090-host-001",
    "hostname": "smash",
    "asset_type": "gpu_workstation",
    "manufacturer": "NVIDIA",
    "model": "NVIDIA GeForce RTX 5090",
    "gpu_count": 1,
    "vram_total_mib": 32607,
    "driver_version": "[recorded_in_evidence_locator]",
    "cuda_reported_version": "13.1",
    "runtime_exposure": {
      "host_runtime": "visible",
      "container_runtime": "visible_via_cdi",
      "rental_platform_runtime": "visible"
    },
    "serial_or_uuid": {
      "gpu_uuid": "[redacted]",
      "board_serial": "[redacted]",
      "privacy_treatment": "redacted",
      "salt_id": null
    },
    "operator": {
      "name": "claude-code-swarm-research-intake",
      "role": "audit_agent",
      "signature": ""
    },
    "observed_at": "2026-05-25T10:57:00Z",
    "evidence_sources": [
      {
        "tool": "nvidia-smi",
        "command": "nvidia-smi --query-gpu=name,memory.used,memory.total,utilization.gpu,temperature.gpu --format=csv,noheader",
        "artifact_path": "receipts/evidence/2026-05-25T10-57-00Z_nvidia_smi_gpu_query.txt",
        "sha256": "0000000000000000000000000000000000000000000000000000000000000000"
      },
      {
        "tool": "nvidia-smi",
        "command": "nvidia-smi --query-compute-apps=pid,process_name,used_memory --format=csv,noheader",
        "artifact_path": "receipts/evidence/2026-05-25T10-57-00Z_nvidia_smi_compute_apps.txt",
        "sha256": "0000000000000000000000000000000000000000000000000000000000000000"
      }
    ]
  },
  "use_case": "rental_readiness",
  "precheck_state": {
    "docker_state": {
      "daemon_running": true,
      "container_count": 0,
      "image_count": 0,
      "storage_driver": "overlay2",
      "runtimes_configured": ["runc", "nvidia"],
      "cdi_devices_present": true,
      "residual_artifacts_found": []
    },
    "model_server_state": {
      "any_model_server_running": true,
      "named_processes": [
        {
          "name": "vllm",
          "pid": 74905,
          "vram_held_mib": 28104,
          "command_line": "python -m vllm.entrypoints.openai.api_server --model /home/smash/models/swarmcurator-9b --served-model-name swarmcurator-9b --port 8088 ...",
          "owner": "smash"
        },
        {
          "name": "llama.cpp",
          "pid": 106275,
          "vram_held_mib": 0,
          "command_line": "python -m llama_cpp.server --model /home/smash/models/swarmjelly-4b/swarmjelly-4b-tribunal.gguf --port 8089 ...",
          "owner": "smash"
        },
        {
          "name": "defendablerouter",
          "pid": 134588,
          "vram_held_mib": 0,
          "command_line": "/home/smash/defendablerouter/.venv/bin/python3 .venv/bin/defendablerouter serve --port 8080",
          "owner": "smash"
        }
      ]
    },
    "rental_platform_service_state": {
      "platform": "vast_ai",
      "services": [
        {"name": "vastai", "active": true, "uptime_seconds": null},
        {"name": "vast_metrics", "active": true, "uptime_seconds": null}
      ]
    },
    "gpu_process_state": {
      "vram_used_mib": 28114,
      "vram_total_mib": 32607,
      "utilization_gpu_percent": 0,
      "temperature_c": 51.0,
      "power_draw_w": 21.55,
      "power_cap_w": 550.0,
      "persistence_mode": "enabled",
      "compute_processes": [
        {"pid": 75037, "process_name": "VLLM::EngineCore", "used_memory_mib": 28104}
      ]
    },
    "storage_mount_state": {
      "mounts": [
        {"device": "/dev/nvme0n1p2", "mount_point": "/", "fstype": "ext4", "healthy": true, "used_percent": 21}
      ]
    },
    "runtime_state": {
      "nvidia_runtime_available": true,
      "cdi_device_available": true,
      "driver_loaded": true,
      "nvml_responsive": true
    },
    "observations": [
      "Renter exited prior to observation; Docker had zero containers.",
      "Despite zero containers, GPU VRAM showed 28,114 MiB used. Investigation identified the local SwarmCurator vLLM process (PID 75037) holding 28,104 MiB.",
      "SwarmJelly llama.cpp server and DefendableRouter sessions were also identified."
    ],
    "pass_fail": "pass_with_observations"
  },
  "contamination_or_residual_workload_findings": [
    {
      "finding_code": "GPU_MEMORY_HELD_BY_LOCAL_PROCESS",
      "severity": "blocker",
      "description": "Local SwarmCurator vLLM process (PID 75037) was holding 28,104 MiB of VRAM at observation time. This is NOT renter contamination — it is a first-party workload that must be stopped before the host can be presented as rental-ready idle.",
      "evidence_locator": "receipts/evidence/2026-05-25T10-57-00Z_nvidia_smi_compute_apps.txt"
    }
  ],
  "remediation_actions": [
    {
      "finding_code": "GPU_MEMORY_HELD_BY_LOCAL_PROCESS",
      "action": "Operator gracefully shut down local model services (vLLM swarmcurator-9b on port 8088, llama.cpp swarmjelly-4b on port 8089, DefendableRouter on port 8080) without touching Vast services (vastai, vast_metrics remained active). Docker containers remained at zero throughout.",
      "result": "resolved",
      "operator_confirmed": true,
      "evidence_locator": "receipts/evidence/2026-05-25T10-58-XX-XZ_service_shutdown_log.txt"
    }
  ],
  "post_remediation_state": {
    "docker_state": {
      "daemon_running": true,
      "container_count": 0,
      "image_count": 0,
      "storage_driver": "overlay2",
      "runtimes_configured": ["runc", "nvidia"],
      "cdi_devices_present": true,
      "residual_artifacts_found": []
    },
    "model_server_state": {
      "any_model_server_running": false,
      "named_processes": []
    },
    "rental_platform_service_state": {
      "platform": "vast_ai",
      "services": [
        {"name": "vastai", "active": true, "uptime_seconds": null},
        {"name": "vast_metrics", "active": true, "uptime_seconds": null}
      ]
    },
    "gpu_process_state": {
      "vram_used_mib": 2,
      "vram_total_mib": 32607,
      "utilization_gpu_percent": 0,
      "temperature_c": 51.0,
      "power_draw_w": 21.55,
      "power_cap_w": 550.0,
      "persistence_mode": "enabled",
      "compute_processes": []
    },
    "storage_mount_state": {
      "mounts": [
        {"device": "/dev/nvme0n1p2", "mount_point": "/", "fstype": "ext4", "healthy": true, "used_percent": 21}
      ]
    },
    "runtime_state": {
      "nvidia_runtime_available": true,
      "cdi_device_available": true,
      "driver_loaded": true,
      "nvml_responsive": true
    },
    "observations": [
      "Post-remediation: VRAM returned to 2 MiB idle, utilization 0%, temperature ~51C, power draw ~21.55W, 550W cap, persistence enabled.",
      "Vast services remained active throughout."
    ],
    "pass_fail": "pass"
  },
  "benchmark_validation_results": [
    {
      "test_id": "TEST-001",
      "test_name": "System requirements test",
      "test_origin": "platform_remote",
      "test_scope": "identity_check",
      "result": "pass",
      "observed_output": {
        "summary": "Platform-remote system requirements test passed.",
        "raw_metrics_recorded_in_evidence_locator": true
      },
      "duration_seconds_if_known": null,
      "evidence_locator": "receipts/evidence/vast_remote_validation_summary.txt",
      "confidence": "high",
      "limitations": "Single-pass remote validation; does not certify long-term operability.",
      "executed_by": "vast_ai remote validator"
    },
    {
      "test_id": "TEST-002",
      "test_name": "ResNet18 GPU functional test",
      "test_origin": "platform_remote",
      "test_scope": "functional_inference",
      "result": "pass",
      "observed_output": {
        "summary": "ResNet18 GPU functional test passed.",
        "raw_metrics_recorded_in_evidence_locator": true
      },
      "duration_seconds_if_known": null,
      "evidence_locator": "receipts/evidence/vast_remote_validation_summary.txt",
      "confidence": "high",
      "limitations": "Single-pass functional inference; does not establish sustained throughput.",
      "executed_by": "vast_ai remote validator"
    },
    {
      "test_id": "TEST-003",
      "test_name": "ECC test",
      "test_origin": "platform_remote",
      "test_scope": "ecc_health",
      "result": "pass",
      "observed_output": {"summary": "ECC test passed."},
      "duration_seconds_if_known": null,
      "evidence_locator": "receipts/evidence/vast_remote_validation_summary.txt",
      "confidence": "high",
      "limitations": "Snapshot ECC check; does not project long-term memory health.",
      "executed_by": "vast_ai remote validator"
    },
    {
      "test_id": "TEST-004",
      "test_name": "NCCL distributed test (single-GPU mode)",
      "test_origin": "platform_remote",
      "test_scope": "distributed_communication",
      "result": "pass",
      "observed_output": {
        "summary": "NCCL distributed test passed with 1 GPU.",
        "configured_gpu_count": 1
      },
      "duration_seconds_if_known": null,
      "evidence_locator": "receipts/evidence/vast_remote_validation_summary.txt",
      "confidence": "high",
      "limitations": "Single-GPU NCCL test cannot exercise inter-GPU bandwidth; multi-GPU host would need re-validation.",
      "executed_by": "vast_ai remote validator"
    },
    {
      "test_id": "TEST-005",
      "test_name": "Combined stress-ng + gpu-burn 60s",
      "test_origin": "platform_remote",
      "test_scope": "stress_combined",
      "result": "pass",
      "observed_output": {
        "summary": "Simultaneous CPU (stress-ng) and GPU (gpu-burn) load held for 60 seconds. No thermal trip, no NCCL error.",
        "duration_seconds": 60
      },
      "duration_seconds_if_known": 60,
      "evidence_locator": "receipts/evidence/vast_remote_validation_summary.txt",
      "confidence": "high",